{
  "id": "drug_reference.quinidine",
  "kind": "drug_reference",
  "subsystem": "drug_reference_sets",
  "tier": "B",
  "primary_citation": "li-2017",
  "drug": {
    "name": "quinidine",
    "unii": "ITX08688JL",
    "chembl": null
  },
  "cipa_set": "training",
  "expert_risk_label": "high",
  "eftpc_nm": {
    "central": 3237.0,
    "units": "nM",
    "kind": "free",
    "citation": "li-2017"
  },
  "extraction": {
    "review_status": "unverified",
    "method": "CiPA working-group training set + free Cmax (EFTPC) from CiPA references",
    "verified_by": [],
    "notes": "Expert risk label and EFTPC from the CiPA training-set literature; unverified."
  },
  "notes": "Expert consensus risk label is GROUND TRUTH for classifier calibration/scoring only — it is NOT a Harmonia output and NOT a clinical determination."
}
