{
  "id": "channel_block.chlorpromazine.ikr",
  "kind": "channel_block",
  "subsystem": "channel_block",
  "tier": "B",
  "primary_citation": "crumb-2016",
  "drug": {
    "name": "chlorpromazine",
    "unii": "U42B7VYA4P",
    "chembl": null
  },
  "channel": "IKr",
  "block_model": "hill",
  "parameters": [
    {
      "symbol": "IC50",
      "label": "half-maximal inhibitory concentration",
      "value": {
        "central": 1212.4356,
        "low": 1000.0,
        "high": 1470.0,
        "units": "nM"
      },
      "tier": "B",
      "primary_citation": "crumb-2016"
    },
    {
      "symbol": "h",
      "label": "Hill coefficient",
      "value": {
        "central": 0.8,
        "low": null,
        "high": null,
        "units": "dimensionless"
      },
      "tier": "B",
      "primary_citation": "crumb-2016"
    }
  ],
  "assay_context": {
    "platform": "mixed",
    "temperature_c": 37,
    "expression_system": "HEK293 / CHO (heterologous)",
    "max_block_observed_percent": 82,
    "holding_protocol": "depolarizing step protocol per source assay"
  },
  "source_values": [
    {
      "ic50_nm": 1470.0,
      "platform": "manual",
      "citation": "crumb-2016",
      "hill": 0.8,
      "temperature_c": 37
    },
    {
      "ic50_nm": 1000.0,
      "platform": "manual",
      "citation": "li-2017",
      "hill": 0.8,
      "temperature_c": 37
    }
  ],
  "variability": {
    "fold_range": 1.47,
    "n_sources": 2,
    "iqr_nm": [
      1117.5,
      1352.5
    ],
    "geomean_nm": 1212.4356
  },
  "known_failure_modes": [],
  "extraction": {
    "review_status": "unverified",
    "method": "literature table transcribed by maintainer; values from CiPA-era patch-clamp datasets",
    "verified_by": [],
    "notes": "Values are literature-derived (see primary_citation / source_values). No source PDF has been confirmed inside Harmonia; review_status stays unverified per spec §9."
  }
}
