{
  "id": "channel_block.cisapride.ical",
  "kind": "channel_block",
  "subsystem": "channel_block",
  "tier": "D",
  "primary_citation": "crumb-2016",
  "drug": {
    "name": "cisapride",
    "unii": "UVL329170W",
    "chembl": null
  },
  "channel": "ICaL",
  "block_model": "hill",
  "parameters": [
    {
      "symbol": "IC50",
      "label": "half-maximal inhibitory concentration",
      "value": {
        "central": 9258075.75,
        "low": 9258075.75,
        "high": 9258075.75,
        "units": "nM"
      },
      "tier": "D",
      "primary_citation": "crumb-2016"
    },
    {
      "symbol": "h",
      "label": "Hill coefficient",
      "value": {
        "central": 0.43,
        "low": null,
        "high": null,
        "units": "dimensionless"
      },
      "tier": "D",
      "primary_citation": "crumb-2016"
    }
  ],
  "assay_context": {
    "platform": "manual_patch_clamp",
    "temperature_c": 37,
    "expression_system": "HEK293 / CHO (heterologous)",
    "max_block_observed_percent": 3,
    "holding_protocol": "depolarizing step protocol per source assay"
  },
  "source_values": [
    {
      "ic50_nm": 9258075.75,
      "platform": "manual",
      "citation": "crumb-2016",
      "hill": 0.43,
      "temperature_c": 37
    }
  ],
  "variability": {
    "fold_range": 1.0,
    "n_sources": 1,
    "iqr_nm": [
      9258075.75,
      9258075.75
    ],
    "geomean_nm": 9258075.75
  },
  "known_failure_modes": [
    {
      "condition": "max_block_observed_percent < 60",
      "behavior": "IC50 not identifiable; any point estimate is an extrapolation and is misleading",
      "action": "tier_down_to_D and warn; exclude from point classification",
      "citation": "chang-2017"
    }
  ],
  "extraction": {
    "review_status": "unverified",
    "method": "literature table transcribed by maintainer; values from CiPA-era patch-clamp datasets",
    "verified_by": [],
    "notes": "Values are literature-derived (see primary_citation / source_values). No source PDF has been confirmed inside Harmonia; review_status stays unverified per spec §9."
  },
  "notes": "Max block observed < 60% — the IC50 is UNIDENTIFIABLE. The value stored is an extrapolation kept only for provenance; it is excluded from point classification and flagged in every assessment that touches this channel."
}
