{
  "id": "ap_model.cipaordv1.0",
  "kind": "ap_model",
  "subsystem": "ap_models",
  "tier": "C",
  "primary_citation": "dutta-2017",
  "model": {
    "name": "IKr-dynamic CiPAORd v1.0 — reduced reference variant",
    "lineage": "O'Hara-Rudy",
    "formulation": "ORd re-optimized for CiPA; IKr re-scaled. Dynamic hERG binding (Langmuir kon/koff with trapping) is available at simulation time for drugs carrying dynamic_binding kinetics (assess(..., herg_dynamic=True)).",
    "currents": [
      "INa",
      "INaL",
      "Ito",
      "ICaL",
      "IKr",
      "IKs",
      "IK1"
    ]
  },
  "model_parameters": [
    {
      "symbol": "g_scale_IKr",
      "label": "IKr conductance scale",
      "value": 1.2,
      "units": "dimensionless"
    },
    {
      "symbol": "g_scale_ICaL",
      "label": "ICaL conductance scale",
      "value": 1.0,
      "units": "dimensionless"
    },
    {
      "symbol": "g_scale_INaL",
      "label": "INaL conductance scale",
      "value": 1.3,
      "units": "dimensionless"
    }
  ],
  "validation": {
    "training_set_reproduced": null,
    "validation_set_accuracy": null,
    "notes": "Default classification model. The reduced-kernel default metric is qNet (discriminating since the Na-Ca exchanger was added and excluded from the qNet sum, Phase C): 10/12 CiPA training labels and zero two-category errors across all 28 compounds; APD90 selectable. Run `harmonia performance` for the live, honest confusion matrix. Not a qualified regulatory classifier (Tier C)."
  },
  "extraction": {
    "review_status": "unverified",
    "method": "reduced CiPAORd variant with dynamic-hERG option",
    "verified_by": [],
    "notes": "Dynamic Langmuir hERG binding implemented (Phase B); full CiPA Markov hERG model + published optimized kinetics pending Phase C."
  }
}
