{
  "id": "drug_reference.diltiazem",
  "kind": "drug_reference",
  "subsystem": "drug_reference_sets",
  "tier": "B",
  "primary_citation": "li-2017",
  "drug": {
    "name": "diltiazem",
    "unii": "EE92BBP03H",
    "chembl": null
  },
  "cipa_set": "training",
  "expert_risk_label": "low",
  "eftpc_nm": {
    "central": 122.0,
    "units": "nM",
    "kind": "free",
    "citation": "li-2017"
  },
  "extraction": {
    "review_status": "unverified",
    "method": "CiPA working-group training set + free Cmax (EFTPC) from CiPA references",
    "verified_by": [],
    "notes": "Expert risk label and EFTPC from the CiPA training-set literature; unverified."
  },
  "notes": "Expert consensus risk label is GROUND TRUTH for classifier calibration/scoring only — it is NOT a Harmonia output and NOT a clinical determination.",
  "protein_binding": {
    "fraction_unbound": 0.2,
    "total_cmax_nm": 610.0,
    "citation": "li-2017"
  }
}
